codigo,nome,descricao,categoria,criticidade,tipo_regra,entidade_ifc,propriedade,operador,valor_esperado,mensagem_reprovacao,sugestao_correcao,referencia,ativo
UNI-IFC-001,Versao IFC aceita,O arquivo deve declarar FILE_SCHEMA em IFC2X3 IFC4 ou IFC4X3,Metadados,alta,ifc_schema,,FILE_SCHEMA,in,IFC2X3|IFC4|IFC4X3,O arquivo IFC nao declara uma versao aceita,Exportar novamente em uma versao IFC aceita pelo projeto,Gate universal IFC,sim
UNI-IFC-003A,IfcSite existente,O arquivo deve possuir IfcSite para apoiar localizacao e coordenacao,Coordenadas,alta,entity_exists,IfcSite,,exists,,O arquivo nao possui IfcSite,Configurar localizacao do projeto no software autoral e reexportar o IFC,Gate universal IFC,sim
UNI-IFC-003B,Latitude do IfcSite preenchida,O IfcSite deve possuir RefLatitude preenchido quando o BEP exigir georreferenciamento,Coordenadas,moderada,property_not_empty,IfcSite,RefLatitude,not_empty,,O IfcSite nao possui latitude preenchida,Definir coordenadas/localizacao do projeto e reexportar o IFC,Gate universal IFC,sim
UNI-IFC-003C,Longitude do IfcSite preenchida,O IfcSite deve possuir RefLongitude preenchido quando o BEP exigir georreferenciamento,Coordenadas,moderada,property_not_empty,IfcSite,RefLongitude,not_empty,,O IfcSite nao possui longitude preenchida,Definir coordenadas/localizacao do projeto e reexportar o IFC,Gate universal IFC,sim
UNI-IFC-004,Nome do projeto preenchido,O IfcProject deve possuir Name preenchido e reconhecivel,Metadados,alta,property_not_empty,IfcProject,Name,not_empty,,O nome do projeto nao esta preenchido no IfcProject,Preencher o nome do projeto no software autoral antes da exportacao,Gate universal IFC,sim
